id,name,text,trans
0000000000000,手毬,う～～ん、充実した時間だった！！,嗯～～，真是充实的时光啊！！
0000000000000,手毬,100プロ最強アイドルの一角に、\n思いっきりぶつかって、競い合って……,身为100企划最强偶像之一，\n我狠狠地冲撞、竞争了一番……
0000000000000,手毬,たくさん質問して、アドバイスをして\nもらって、一緒に歌って、\nお手本まで見せてもらって……,问了好多问题，得到了很多建议，\n还一起唱歌，甚至给我看了示范表演……
0000000000000,手毬,『H.I.F』本戦の前に、\nまた一歩、成長できた実感がある！,在『H.I.F』正式比赛之前，\n我感觉自己又迈出了一步，有所成长！
0000000000000,美鈴,ご機嫌ですね、まりちゃん。,您心情不错呢，小麻。
0000000000000,手毬,美鈴だって。私に負けないくらい\n質問責めにしてたくせに。,美铃也一样啊。你不是也跟我差不多，\n问个不停吗？
0000000000000,美鈴,教えを乞うに値する方でしたから。\nわたし、怠け者なんです。,因为那是值得求教的对象。\n我呢，是个懒散的人。
0000000000000,美鈴,楽に成長できる機会は、逃しませんよ。,能轻松成长的机会，我可不会放过哦。
0000000000000,手毬,美鈴がそんなふうに言う相手……\n久しぶりだ。,美铃会这样评价对方……\n真是久违了呢。
0000000000000,手毬,親切なひとだったね。\n腰が低くて、ちっとも偉ぶらなくて。,她是个很亲切的人呢。\n态度谦逊，一点都没有架子。
0000000000000,美鈴,そうですね……あれが、\nわたしたちのしっている、\n先代『<r\=プリマステラ>一番星</r>』のイメージです。,是啊……那正是，\n我们所认识的，\n前任『一等星』的形象呢。
0000000000000,手毬,ステージではがんばってキャラ作り\nしてたのかな？　だとしたら……\n親近感わいちゃうかも。,在舞台上是不是在努力塑造角色呢？\n如果是的话……\n说不定会让我感到亲近呢。
0000000000000,美鈴,ん～～～……………どうでしょう。,嗯～～～…………… 这谁知道呢。
0000000000000,美鈴,まりちゃん……くれぐれも\n真似しちゃだめですよ？,小麻……千万别模仿她哦？
0000000000000,手毬,ハイハイ、わかってるって。,好好好，我知道啦。
0000000000000,美鈴,それと……ひと通りもありませんし。\n大丈夫ですよ。大声を出しても。,而且……也没什么好吵闹的。\n没事的，就算大声喊也没关系。
0000000000000,手毬,あっそ。じゃあ、遠慮なく……,这样啊。那，我就不客气了……
0000000000000,手毬,また負けた……！　トップアイドルに！\n届かなかった……！,又输了……！输给了顶级偶像！\n没能触及到她……！
0000000000000,美鈴,トップアイドルの<em\=>遠さ</em>を、\n思い知らされてしまいましたね。,我们真是彻底领教了顶级偶像的<em\=>遥远</em>呢。
0000000000000,美鈴,はぁ……困りました。\nここから京都まで歩いていくくらい、\n面倒そうです。,唉……这可麻烦了。\n感觉就像要从这里走到京都一样，\n真是麻烦透顶。
0000000000000,手毬,必死になったらできそうなたとえ。\n美鈴らしいな。,拼命去做的话似乎就能做到。\n真像美铃啊。
0000000000000,手毬,飄々としちゃって……悔しくないの？,这么漫不经心的……难道不觉得不甘心吗？
0000000000000,美鈴,ちっとも悔しくありませんよ。\nどんなに遠くとも、いずれ着きます。,一点也不觉得不甘心哦。\n无论多么遥远，终将到达。
0000000000000,手毬,嘘つき。,骗人。
0000000000000,美鈴,なんのことやら。,你在说什么呀。
0000000000000,手毬,忘れたの？　そっくりなやりとり。\n前にもしたよ。,忘了吗？几乎一模一样的对话。\n之前也做过哦。
0000000000000,手毬,継さんの全盛期。『SyngUp!』が\n燐羽のワンマンユニットだって\n言われてた一番最初の頃。,继的全盛期。『SyngUp!』被说成是\n燐羽的个人组合的\n最初那段日子。
0000000000000,手毬,ふたりの背が遠すぎて。なのに\nレッスンについていくことさえ\nできなくて。,我们俩的身高差得太远了。明明连跟上训练\n都做不到。
0000000000000,手毬,悔しすぎて泣いてる私の前で、\n美鈴は平気そうな顔してた。,在我因为太过不甘心而哭泣的时候，\n美铃却是一脸若无其事的样子。
0000000000000,手毬,いずれ追いつくから大丈夫。\nゆっくり歩こうって慰めてくれたよね。,你安慰我说，总有一天能追上的所以没关系，\n慢慢走吧。
0000000000000,美鈴,そんなことも……ありましたね。,居然还有过那种事啊。
0000000000000,手毬,見たよ。美鈴が……隠れて泣いてるの。,我看到了哦。美铃……在偷偷地哭。
0000000000000,美鈴,……見間違いです。,……你看错了。
0000000000000,手毬,それでもいいよ。\n夢でも、幻覚でも、なんでも。,就算是那样也没关系。\n就当是梦也好，幻觉也好，什么都行。
0000000000000,手毬,あんなに悔しそうなあなたは、\nはじめて見た。,我第一次看到你\n露出那么不甘心的表情。
0000000000000,手毬,見ていたら、もっと悔しくなった。\n悔しくて苦しくて、その原因も正体も\nわからないまま歯を食いしばって。,看着那样的你，我也变得更加不甘心了。\n不甘心到难受，却连原因和真相都\n不知道，只能咬紧牙关。
0000000000000,手毬,ぽろっと取れた乳歯を飲み込んじゃって\n大変なことになったんだよ。,结果把松动的乳牙吞下去了，\n搞得一团糟呢。
0000000000000,美鈴,あのときは大騒ぎになって\n涙が引っ込みました……！,那时候引起了很大的骚动，\n眼泪就这么止住了……！
0000000000000,手毬,ほら、やっぱり泣いてたんじゃん。,看吧，果然还是哭了吧。
0000000000000,美鈴,………………………………………………,………………………………………………
0000000000000,手毬,いまなら、\n自分の気持ちを言葉にできる。,现在的话，\n我能够将自己的心情化作语言。
0000000000000,手毬,あの日の私は……燐羽と継さんに、\n美鈴を取られたみたいに感じてた。,那天的我……感觉就像是燐羽和继，\n从我手中抢走了美铃一样。
0000000000000,美鈴,えっ……？,诶……？
0000000000000,手毬,美鈴があんな風に泣くの、\nはじめて見たから。,因为我还是第一次看到美铃，\n哭成那个样子。
0000000000000,手毬,いつも穏やかに微笑んでいて、\nいつも頼りになって、なんでもできて。,她总是温柔地微笑着，\n总是可靠无比，无所不能。
0000000000000,手毬,そうじゃない美鈴がいたんだって……\n当たり前のことに、はじめて気づいた。,原来也有不是那样的美铃存在……\n直到现在，我才第一次注意到这件理所当然的事。
0000000000000,手毬,私には、絶対見せない顔だった。\n私の歌じゃ、あなたの感情を\n動かせなかった。,那是我绝对看不到的表情。\n我的歌，无法动摇你的感情。
0000000000000,手毬,それが悔しかったんだよ……！,我就是不甘心啊……！
0000000000000,美鈴,まりちゃん……,小麻理……
0000000000000,手毬,あなたはまた、\n私の見ていないところで泣くの？,你又要在我看不见的地方，\n偷偷哭泣吗？
0000000000000,手毬,プロデューサーの前では、\n私に見せない顔をするの？,在制作人面前，\n你也会露出不给我看的那一面吗？
0000000000000,手毬,答えて……！,回答我……！
0000000000000,美鈴,はい。,是的。
0000000000000,美鈴,プロデューサーは、わたしにとって、\n特別なひとなんです。,对我来说，制作人，\n是特别的人。
0000000000000,美鈴,<em\=>あなたと同じくらいに</em>。,<em\=>和你一样</em>。
0000000000000,手毬,そう。,这样啊。
0000000000000,手毬,私、『H.I.F』が終わったら、\n100プロに入るよ。,我，等『H.I.F』结束后，\n要加入100pro。
0000000000000,手毬,もちろん『<r\=プリマステラ>一番星</r>』になってね。,当然是作为『<r\=プリマステラ>一等星</r>』。
0000000000000,手毬,覚悟しなよ、美鈴。今度こそ……！,做好准备吧，美铃。这次一定……！
0000000000000,手毬,私の歌で、あなたを泣かせてやるから！,我会用我的歌，让你哭出来的！
info,adv_dear_hmsz_032.txt,,
译者,,,
