id,name,text,trans
0000000000000,佑芽,あっ、広ちゃんだ！　\nおっはよ～～～っ！,啊，是小广！\n早上好～～～！
0000000000000,千奈,おはようございます、篠澤さんっ！,早上好，筱泽同学！
0000000000000,広,佑芽……千奈……\nたいへんなことになった。,佑芽……千奈……\n出大事了。
0000000000000,佑芽,広ちゃんがこんなに動揺している\nところ、はじめて見たかも……！,我还是第一次看到\n小广这么慌张的样子……！
0000000000000,千奈,いったいどうなさいましたの！？,到底发生什么事了！？
0000000000000,広,星南がトップアイドルになったって、\nほんとう？,星南成为顶级偶像，\n是真的吗？
0000000000000,佑芽,本当で～～～～～～～～～～っす♪,是真的～～～～～～～～～～～～！
0000000000000,千奈,はいっ！　\n星南お姉さまは、一夜にして――,是的！\n星南姐姐大人一夜之间——
0000000000000,星南,アイドルの頂点は――,偶像的顶点就在——
0000000000000,星南,あなたたちの夢は、ここにある！,你们的梦想，就在这里！
0000000000000,千奈,アイドルの頂点へと\n上り詰めたのですわ～～～♪,攀登到了偶像的巅峰～～～～♪
0000000000000,佑芽,今日はみんな、\nその話題でもちきりなんだよ！,今天大家\n都在热议这件事呢！
0000000000000,佑芽,伝説のアイドルの皆さんに、\n十王星南が勝利宣言をしたって！,十王星南向传说中的偶像们\n宣布了胜利宣言！
0000000000000,千奈,うふふ、今冬の『H.I.F』は、\n例年よりもずっとずうっと……,嗯哼，今年冬天的『H.I.F』，\n会比往年更更更……
0000000000000,千奈,ハイレベルな大会になりそうですわ。,高水平的大赛了呢。
0000000000000,千奈,なにせ現『<r\=プリマステラ>一番星</r>』がトップアイドルに\nなったのですもの。,毕竟现在的『<r\=プリマステラ>一等星</r>』\n成为了顶级偶像。
0000000000000,千奈,もしもいまの星南お姉さまに\n勝てたなら……その御方は、正真正銘。,如果能赢过现在的星南姐姐大人……那位，就是名副其实。
0000000000000,千奈,トップアイドルですわ～～～～～～♪,顶级偶像了～～～～～～♪
0000000000000,広,こひゅっ……,呼……（抽气声）
0000000000000,広,はー……はー……\nあばばばばばば……,哈……哈……\n啊啊啊啊啊啊啊啊……
0000000000000,佑芽,広ちゃん！？,小广！？
0000000000000,千奈,顔色が……顔色が……\n真っ青ですわ……！,脸色……脸色……\n一片惨白呢……！
0000000000000,広,ふ、ふふ……ふふふふ……,呵、呵呵……呵呵呵呵……
0000000000000,広,命を賭けた瞬間……\nハードルが天元突破した。,赌上性命的瞬间……\n难度突破了天际。
0000000000000,星南,はああああああ……！　\nハアアアアアアア………！！,哈啊啊啊啊啊……！\n哈啊啊啊啊啊啊………！！
0000000000000,広,ふふ。あなたの魅力、\n上がってるの、かも。,呵呵。你的魅力，\n或许在上升呢。
0000000000000,広,思い返せば……予兆はあった、けど。\nまさか……あれが伏線だったなんて……,回想起来……征兆是有的，不过。\n没想到……那竟然会是伏线……
0000000000000,広,さすがにわからない。うごごごご……,这怎么也想不明白。唔咕咕咕咕……
0000000000000,広,ふっ……\nやっぱりわたし……持ってる、ね。,呵……\n果然我……运气不错，呢。
0000000000000,広,というわけで……\nのっぴきならない状況。,所以说是……\n无法抽身的状况。
0000000000000,広,大怪獣とハイテンションの佑芽が\n同時に襲来したかのような衝撃。,就像大怪兽和亢奋状态的佑芽\n同时袭来一样的冲击。
0000000000000,広,ふふ、どうしよう。破滅の予感。,呵呵，怎么办。毁灭的预感。
0000000000000,広,あなたは以前、わたしが星南に勝てる\n確率は2％もあるって言った。,你以前说过，我能赢过星南的\n概率有2%。
0000000000000,広,星南がトップアイドルになって、\nパワーアップして。,星南成了顶级偶像，\n实力升级了。
0000000000000,広,いまは、どう？,现在呢？
0000000000000,{user},……0ではありません。,……不是0。
0000000000000,広,……0じゃないんだ。,……不是0啊。
0000000000000,広,すごい、ね、わたし。,真厉害，呢，我。
0000000000000,{user},そうでしょう？　\n自慢の担当アイドルなんです。,对吧？\n这可是我引以为傲的担当偶像哦。
0000000000000,{user},トップアイドルを向こうに回して、\n競技性の高い新生『H.I.F』で――,以顶级偶像为对手，\n在高竞技性的新生『H.I.F』中——
0000000000000,{user},――勝つ可能性がわずかにある。,——赢的可能性微乎其微。
0000000000000,広,入学したばかりの頃、わたしはまともに\nレッスンを受けられなかった、ね。,刚入学那会儿，我没能好好\n参加训练，嗯。
0000000000000,広,アイドルとして、\nステージに上がるなんて……,作为偶像，\n站上舞台什么的……
0000000000000,広,無理だってみんなが言った。,大家都说，这不可能。
0000000000000,{user},出逢ったばかりの頃、あなたには\nアイドルとして見所がなかった。,刚认识的时候，你\n作为偶像毫无闪光点。
0000000000000,{user},使うつもりのない学力と、\n美しい外見だけが取り柄だった。,只有不打算使用的学历和\n美丽的外表是你的可取之处。
0000000000000,広,ままならない日々だった、ね。,那真是难以如愿的日子，呢。
0000000000000,{user},胃痛と困惑に悩まされる日々でした。,那是被胃痛和困惑折磨的日子。
0000000000000,広,あそこから……ここまで来たよ。\nあなたと一緒に。,从那里……走到了这里哦。\n和你一起。
0000000000000,広,とんでもない奇跡。,真了不起的奇迹。
0000000000000,{user},では、もう一度、お願いします。\nそれだけのことです。,那么，请再听一次我的请求。\n仅此而已。
0000000000000,広,ふふ、簡単に言う。……わたしは、ね。\n身の程知らずにも……,呵呵，说得真简单。……我可是，呢。\n不知天高地厚地……
0000000000000,広,学園一のアイドルに\nなるつもりだった。,打算成为学园第一的偶像。
0000000000000,広,『<r\=プリマステラ>一番星</r>』になってはじめて……,只有在成为『一等星』之后……
0000000000000,広,誰もが認めるすごいアイドルに\nなって、はじめて……,只有在成为\n所有人都认可的超强偶像之后……
0000000000000,広,『みんなと同じ夢』を口にする資格が\n得られる。……そう思ってた。,才有资格说出‘和大家相同的梦想’。\n……我曾是这么想的。
0000000000000,{user},それはそれは……十王星南に予定を\n狂わされてしまいましたね。,那还真是……被十王星南\n打乱了计划呢。
0000000000000,広,ほんとうに、そう。,真的，没错。
0000000000000,広,みんなの憧れ。初星学園のNo.1は、\nそういうことする。,大家的憧憬。初星学园的No.1，\n就会做这种事。
0000000000000,広,わたし……十段飛ばしで、\n夢に挑戦する羽目になっちゃった。,我……被迫跳过十级，\n直接向梦想发起挑战了。
0000000000000,{user},素晴らしい窮地です。そのおかげで……\n十王星南流に言うならば……,真是个绝妙的困境。多亏了这样……\n用十王星南的话来说……
0000000000000,{user},篠澤広のアイドルパワーが、\n急激に上昇しつつある。,筱泽广的偶像力量，\n正在急剧上升。
0000000000000,広,楽しそう。,看起来很开心呢。
0000000000000,{user},趣味ですから。,因为这是我的兴趣。
0000000000000,広,趣味ならしょうがない。,既然是兴趣，那也没办法。
0000000000000,{user},さあ！　まずはより難易度の増した\n『<r\=セレクション>選抜試験</r>』を突破しなければ！,来吧！首先必须突破难度更高的\n『<r\=选拔>选拔考试</r>』！
0000000000000,広,負ければ終わり。わたしたちの夢も、\n趣味も……なにもかも。,输了就结束。我们的梦想也好，\n兴趣也好……一切都会消失。
0000000000000,広,『H.I.F』……初星学園最大のお祭り。,『H.I.F』……初星学园最大的祭典。
0000000000000,広,わたしたちにとっては、\nデスゲーム、だね。,对我们来说，\n就像是死亡游戏呢。
0000000000000,{user},楽しそうですね。,听起来很开心呢。
0000000000000,広,だって……趣味だから。,因为……这是我的兴趣。
0000000000000,広,苦しくて、ままならない、\nわたしが望んだ日々だから。,痛苦、不如意，\n这正是我渴望的日子。
0000000000000,広,でも、ね。,但是，啊。
0000000000000,広,失いたくない、な。\nなくしたくない、な。,不想失去啊。\n不愿失去啊。
0000000000000,広,かつてない窮地の中で\n『サンフェーデッド』を歌った……,在前所未有的困境中唱出了\n『阳光枯萎』……
0000000000000,広,あの日と同じ感覚が……\nより強い焦燥が、胸で燃えている。,和那天相同的感觉……\n更强烈的焦躁在胸中燃烧。
0000000000000,{user},わずかな勝機は、<em>そこ</em>にあります。,微小的胜机，就在<em>那里</em>。
0000000000000,{user},デスゲームを乗り越えた篠澤広が、\n『H.I.F』を灼き尽くし――,跨越了死亡游戏的筱泽广，\n将燃尽『H.I.F』——
0000000000000,広,一番星をつかみ取る、よ！,抓住一等星，哟！
info,adv_dear_shro_029.txt,,
译者,,,
