id,name,text,trans
0000000000000,千奈,星南お姉さま！　皆さん！　\nよろしくお願いいたします！,星南学姐！各位！\n请多多关照！
0000000000000,星南,こちらこそよろしく、千奈。\n申し出を受けてくれて、ありがとう。,彼此彼此，千奈。\n感谢你接受了我们的请求。
0000000000000,星南,まずは一緒に特訓をするメンバーを\n紹介しておくわ。,首先，我来介绍一下\n一起特训的成员。
0000000000000,佑芽,よろしく～、千奈ちゃん♪,请多关照～，小千奈♪
0000000000000,広,我ら元補習組……\nひとときの再結成、だね。,我们原补习班……\n算是暂时的重组吧。
0000000000000,千奈,まぁ……素敵な特訓になりそうですわ♪,哎呀……看来会是\n一场精彩的训练呢♪
0000000000000,星南,続いて、特別コーチの紹介よ。,接下来，介绍特别教练。
0000000000000,美鈴,ふふ……よろしくお願いします。,呵呵……请多指教。
0000000000000,手毬,ふっ……よろしく、千奈。,哼……请多指教，千奈。
0000000000000,千奈,まぁ！　秦谷さん、月村さん！　\nおふたりが……コーチを？,哎呀！秦谷同学，月村同学！\n你们两个……是教练？
0000000000000,手毬,まだ言ってなかったよね。\n私と美鈴、今冬の『H.I.F』には\n出場しないんだ。,还没跟你说过吧。\n我和美铃，这次冬天的『H.I.F』\n不参加了。
0000000000000,美鈴,ようやく『SyngUp!』のメンバー\n全員が仲直りできましたので……,因为终于，『SyngUp!』的成员\n全部和解了……
0000000000000,美鈴,かつてできなかった……\n解散ライブの準備をしているんです。,所以准备举办当年没能实现的……\n解散演唱会。
0000000000000,手毬,トップアイドルに挑んで、\n一気に夢を叶える――,挑战顶级偶像，\n一口气实现梦想——
0000000000000,手毬,絶好の機会を逃したくはないんだけど。\n二兎を追うものは……っていうしね。,我不想错过绝佳的机会。\n但俗话说，追二兔者不得一兔。
0000000000000,手毬,今回はパス。\n次回、万全の態勢で臨むことにする。,这次就放弃了。\n下次，我会以万全的态势参加。
0000000000000,星南,あら、まるで参加すれば\n私に勝てるような言い草ね。,哎呀，说得好像你参加了\n就能赢过我似的。
0000000000000,手毬,勝ちます。当然です。会長のことは\n尊敬していますけど。,我会赢的。当然。虽然我很尊敬会长。
0000000000000,手毬,胸を借りるつもりで、だなんて。\nそんな甘い気持ちでは挑みませんよ。,说什么抱着学习的态度。\n我可不会用那么天真的心态去挑战。
0000000000000,星南,そう……理想の後輩ね。\nあなたの不参加は実に惜しいわ。,这样啊……真是个理想的学妹。\n你不参加，实在太可惜了。
0000000000000,美鈴,星南会長。わたしも、\nあなたに勝てると思っていますよ。,星南会长。我也是，\n觉得能赢过你呢。
0000000000000,星南,ウフフ……本当に舐めた後輩ね。\n来年も出なくていいわよ。,呵呵……真是个狂妄的学妹呢。\n明年也不用出场了哦。
0000000000000,美鈴,まぁ、ひどい。まりちゃん、このひと\nいつもわたしにだけ厳しいんです。,哎呀，好过分。麻衣酱，这个人\n总是对我特别严厉。
0000000000000,手毬,自業自得でしょ。自分の\nプロデューサーをもっと敬いなよ。,自作自受吧。对自己的\n制作人更多一点尊重啊。
0000000000000,星南,フフ……今後、学外のイベントで、\n私たちがぶつかることもあるでしょう。,哼哼……今后，在校外的活动中，\n我们也会有交锋的机会吧。
0000000000000,星南,そのときに思い知らせてあげるわ美鈴。\n先輩アイドルの偉大さをね。,到时候就让你明白美铃。\n前辈偶像的伟大之处。
0000000000000,星南,こほん、というわけで……\nこれからのことだけど。,咳咳，总之呢……\n关于今后的事情。
0000000000000,佑芽,あたしたち3人で特訓するんですよね！,我们三个人要特训对吧！
0000000000000,佑芽,それで、どきゅめんたりー？　\nを作って全国放送する～って。,然后，把那个……纪录片？\n制作出来在全国播放～这样。
0000000000000,星南,ええ、目的は『H.I.F』を\nしっかりと盛り上げるためよ。,嗯，目的是为了好好炒热『H.I.F』。
0000000000000,星南,私の夢のひとつは『<r\=プリマステラ>一番星</r>』を\n学園一のアイドルではなく、,我的一个梦想是，让『<r\=普丽玛斯特拉>一等星</r>』\n不再仅仅是学园第一偶像的称号，
0000000000000,星南,トップアイドルを表す称号に\nすることなの。,而是代表顶级偶像的称号。
0000000000000,星南,トップアイドルとなった私が、当然の\nように連覇する――それではダメ。,成为顶级偶像的我，理所当然地\n连霸——那样是不行的。
0000000000000,星南,私の夢を叶えるために必要なのは……\n白熱した名勝負と、<em\=>その予感</em>。,为了实现我的梦想，所需要的是……\n白热化的名胜负，以及<em\=>那份预感</em>。
0000000000000,星南,私に対抗しうる、優勝候補の存在よ。,即能够与我抗衡的优胜候补的存在。
0000000000000,広,だから、わたしたちを\n鍛えることにした。,所以，我决定要锻炼我们。
0000000000000,手毬,十王星南以外にも優勝候補がいるぞ、\nと、学内外にアピールすることにした。,我决定要向学园内外展示，除了十王星南之外，\n还有其他优胜候补存在。
0000000000000,星南,ええ。,嗯。
0000000000000,美鈴,まあ、傲慢ですね。\nひとのことを言えませんよ。,哎呀，真是傲慢呢。\n不过我也没资格说别人。
0000000000000,星南,私自身は、とっくに認めているわ。ここ\nにいる全員が、対等なライバルだと。,我自己，早就认定了。在座\n的各位，都是对等的竞争对手。
0000000000000,千奈,お姉さま……,姐姐大人……
0000000000000,星南,そう言ったでしょう――次期会長？\n楽勝だなんてとんでもないわ。,我不是说过了吗——下一届学生会长？\n说什么轻而易举，简直太可笑了。
0000000000000,星南,ライバル相手に油断なんてしない。\nたとえトップアイドルになろうとね。,我可不会对对手掉以轻心。\n就算是要成为顶级偶像也一样。
0000000000000,佑芽,それでこそあたしの\nプロデューサーちゃんです！,这才配得上我\n的制作人嘛！
0000000000000,星南,……ただ、十王星南は一夜にして、\n格を上げすぎてしまった。,……只是，十王星南在一夜之间，\n把自己的格调抬得太高了。
0000000000000,星南,いまや今冬の『H.I.F』は、\nトップアイドル・十王星南の大会に\nなってしまっている――,如今，这个冬天的『H.I.F』，\n已经变成了顶级偶像·十王星南的舞台——
0000000000000,星南,その誤った認識を叩き壊しましょう！　\n初星学園のアイドルは\n十王星南だけではないと……,让我们打破这种错误的认知吧！\n初星学园的偶像，\n可不只有十王星南一个人……
0000000000000,星南,学内外のアイドルファンに\n思い知らせてやりましょう！,让校内外的偶像粉丝们\n好好认清这一点吧！
0000000000000,千奈,望むところですわ！　\nわたくし先生に誓ったのです！,正合我意！\n我可是对老师发过誓的！
0000000000000,千奈,遥かな先の未来ではなく、\nいま、『<r\=プリマステラ>一番星</r>』になると！,不是遥远的未来，\n而是现在，成为『<r\=プリマステラ>一等星</r>』！
0000000000000,千奈,星南お姉さまを相手に、\n会心のまぐれ勝ちをお見せすると！,以星南姐姐大人为对手，\n展示一场完美的侥幸胜利！
0000000000000,星南,そ、そう……言ってよかったの？　\nカメラはもう回っているのだけど……,这、这样……说出来没问题吗？\n摄像机已经开拍了哦……
0000000000000,千奈,もちろんですわ。ありのままの\nわたくしを見ていただかなくては。,当然没问题。必须让大家看到\n真实的我。
0000000000000,千奈,特訓で実力を付けていく過程を、\n皆さまに見届けていただかなくては。,必须让大家见证我通过特训\n增强实力的过程。
0000000000000,千奈,その先にこそ、可能性が開けるのだと、\nそう思いますわ。,我认为，只有在那之后，\n可能性才会展现出来。
0000000000000,星南,――――あなたたちのその光が、\n私に限界を超えさせた。,————你们的光芒，\n让我超越了极限。
0000000000000,千奈,えっ？,咦？
0000000000000,星南,この特訓で強化されるのは、あなた\nたちだけじゃないということよ。,这场特训中被强化的，\n可不只有你们而已哦。
0000000000000,星南,共に、昇っていきましょう、千奈。,让我们一起，升华吧，千奈。
0000000000000,千奈,はいっ！,好的！
0000000000000,手毬,じゃ、さっそく歌唱力の特訓するよ。\nまずは課題曲の\n『ガラクタロード』から。,那我们就立刻开始声乐训练吧。\n先从课题曲\n『ガラクタロード』开始。
0000000000000,一同,お願いします！,拜托了！
0000000000000,美鈴,ほどほどに……がんばりましょうね。,适可而止……一起努力吧。
0000000000000,手毬,美鈴はああ言ってるけど、\n私は厳しくいかせてもらう。,美铃虽然那么说，\n但我可不会手下留情。
0000000000000,手毬,あなたたちの歌を、本戦までに\n一段上まで引き上げてみせる。\nそれが私の……今回の仕事だから。,我会在正式比赛前，\n把你们的歌声提升到一个新高度。\n这就是我……这次的工作。
0000000000000,広,……そういう台詞が聞きたかった。,……我就想听这种话。
0000000000000,千奈,わたくしに……できるでしょうか。,我能……做到吗？
0000000000000,手毬,できるよ、あなたなら。\n教えられるよ、私なら。,能啊，如果是你的话。\n我教得了，如果是我的话。
0000000000000,手毬,いままで何度も、\nやってきたことでしょ。,这以前不是做过很多次了吗？
0000000000000,千奈,そうでしたわね……\nいつもお世話になっております。,是啊……\n总是承蒙关照了。
0000000000000,手毬,どういたしまして。,不客气。
0000000000000,手毬,あの、さ。私たちにとって……\n『H.I.F』は夢の始まりなんだ。,那个啊，对我们来说……\n『H.I.F』是梦想的起点。
0000000000000,手毬,『<r\=プリマステラ>一番星</r>』は……特別な……\n憧れの称号なんだ。,『<r\=プリマステラ>一等星</r>』是特别的……\n令人憧憬的称号。
0000000000000,手毬,譲れないこだわりがあって……\nだからこそ、今年はもう挑めない。,有着不能退让的执着……\n正因如此，今年已经无法挑战了。
0000000000000,手毬,来年の『H.I.F』までに、\n<em\=>まずは</em>トップアイドルになっておく。,在明年的『H.I.F』之前，\n<em\=>首先</em>要成为顶级偶像。
0000000000000,手毬,それから挑むよ――\n『<r\=プリマステラ>一番星</r>』倉本千奈に。,然后再去挑战——\n『<r\=プリマステラ>一等星</r>』仓本千奈。
0000000000000,千奈,月村さん……いままでで一番……\nお言葉が……強いですわ。,月村同学……这是至今为止……\n说话最……强硬的一次呢。
0000000000000,手毬,いけない？　\n私、あなたのファンだけど？,不行吗？\n我可是你的粉丝哦？
0000000000000,千奈,まぁ……うふふ……ファンなら……\n仕方ありませんわね。,哎呀……呵呵……既然是粉丝……\n那就没办法了呢。
0000000000000,千奈,承りました。その夢のような光景、\nきっと実現させてみせますわ。,明白了。那梦幻般的景象，\n我一定会让它实现。
info,adv_dear_kcna_031.txt,,
译者,,,
