id,name,text,trans
0000000000000,莉波,もうこんな時間ですね。,已经到这个时候了啊。
0000000000000,燕,日が落ちるのも、\nすっかり早くなったな。,太阳落山的时间，\n真是变得快多了。
0000000000000,星南,今日はこのあたりで切り上げて、\nあとは1年生に引き継ぎましょう。,今天就到此为止吧，\n剩下的交给一年级生接手好了。
0000000000000,莉波,そうですね。,是啊。
0000000000000,莉波,みんなもう、私たちがいなくても、\nちゃんとお仕事できてますし。,大家现在就算没有我们在，\n也能好好完成工作了。
0000000000000,星南,……うーん。佑芽は、\nまだちょっと心配なところもあるけど。,……嗯。佑芽的话，\n我还是有点担心的地方。
0000000000000,燕,秦谷のマイペースも、\n相変わらずだからな。,秦谷那个随性的性子，\n也还是老样子呢。
0000000000000,莉波,大丈夫。千奈ちゃんが、\nしっかりまとめてくれるよ。,没关系。有千奈同学在，\n她会好好统揽大局的。
0000000000000,星南,……ええ、そうね。,……嗯，也是呢。
0000000000000,星南,きっと今以上に、初星を\n素晴らしい学び舎にしてくれるわ。,她一定会让初星，\n比现在更成为一所出色的学府吧。
0000000000000,莉波,お茶、淹れましょうか。,要不要泡点茶呢？
0000000000000,莉波,この前、美鈴ちゃんに\n京都の美味しいお茶を貰ったんです。,之前，美铃同学给了我\n一些京都的好茶。
0000000000000,星南,ありがとう。いただくわ。,谢谢，那我就尝尝吧。
0000000000000,燕,ああ、私のぶんは大丈夫だ。\nレッスン室を予約しているのでな。,啊，我就不用了。\n我预约了训练室。
0000000000000,燕,……姫崎。,……姬崎。
0000000000000,燕,『<r\=セレクション>選抜試験</r>』で当たったときは、\n当然、手加減はしないぞ。,在『<r\=セレクション>选拔考试</r>』中对上的时候，\n我当然不会手下留情的。
0000000000000,莉波,うん。負けないよ、燕ちゃん。,嗯。我不会输的，小燕。
0000000000000,燕,ふっ、いい顔になったな、姫崎。,呵，表情不错嘛，姬崎。
0000000000000,星南,……ふぅ。いい香り。,……呼。好香啊。
0000000000000,星南,この生徒会室で、\n莉波の淹れてくれたお茶を飲めるのも、\nあと何回かしらね……,在这间学生会室里，\n能喝到莉波泡的茶，\n也不知道还有几次了呢……
0000000000000,莉波,……――,……——
0000000000000,星南,莉波、レッスンの調子はどう？,莉波，训练情况怎么样？
0000000000000,莉波,今は絶好調ですよ。,现在状态绝佳哦。
0000000000000,莉波,最近はハードなレッスンは、\n少しお休みして、,最近我暂时放下高强度的训练，
0000000000000,莉波,基礎レッスンを重点的に\nするようにしているんです。,重点集中在基础训练上。
0000000000000,星南,ふふ、そう。本戦で競えるのを、\n楽しみにしているわ。,呵呵，是吗。我很期待能在正赛中与你一较高下。
0000000000000,莉波,はい。夏の『H.I.F』のときは、\n悔しい思いをしたので……,是的。因为夏天『H.I.F』的时候，\n让我很不甘心……
0000000000000,星南,……――,……——
0000000000000,莉波,お父さんの事故のことも、\nあったんですけど……,关于父亲的事故，\n也发生过……
0000000000000,莉波,あのときの私には、\nまだ、迷いがあって。,但那时候的我，\n心里还是有犹豫。
0000000000000,莉波,私のアイドルにかける気持ち、\nアイドルを好きな気持ちは――,我对偶像投入的感情，\n喜欢偶像的心情——
0000000000000,莉波,本物なのかなって。,真的是真的吗。
0000000000000,莉波,星南会長に挑む資格、\n本当にあるのかなって――\n心のどこかで不安だったんです。,我有没有资格挑战星南会长，\n真的具备那份资格吗——\n内心深处一直感到不安。
0000000000000,莉波,そんな気持ちだったから、\nお父さんのことがなくても、\nきっと会長に勝つことはできなかった。,因为怀着这样的心情，\n所以即便没有父亲的事，\n我大概也无法战胜会长吧。
0000000000000,星南,今はもう、迷いは晴れた？,现在已经不再迷茫了？
0000000000000,莉波,――はい。,——是的。
0000000000000,莉波,私はアイドルが好き。\nアイドルをしている私が好き。,我喜欢偶像。\n我喜欢作为偶像的自己。
0000000000000,莉波,アイドルの私を応援してくれる、\nファンのみんなが好き。,我喜欢支持我偶像身份的，\n每一位粉丝。
0000000000000,莉波,だから、今度は勝ちます。\n『<r\=プリマステラ>一番星</r>』になってみせます。,所以，这次我会赢。\n我会成为『<r\=プリマステラ>一等星</r>』给你看。
0000000000000,星南,ふふ、アイドルは三日会わざれば、\n刮目して見よ、と言うけれど。,呵呵，虽说偶像三日不见，\n当刮目相看。
0000000000000,星南,本当に、<em\=>強くなった</em>。,真的，<em\=>变强了</em>。
0000000000000,星南,だけど、私に勝つには、\nまだ足りないところがあるわね。,但是，要想赢过我，\n你还有不够的地方呢。
0000000000000,莉波,足りないところ……,不够的地方……
0000000000000,星南,莉波、私に敬語で話すでしょう？\n……同級生なのに。,莉波，你对我说话是用敬语吧？\n……明明我们是同级生。
0000000000000,莉波,それは……,那是因为……
0000000000000,莉波,会長は、私の憧れのアイドルで、\n心から尊敬する人で……だから……,会长是我憧憬的偶像，\n是我真心尊敬的人……所以……
0000000000000,星南,燕は『燕ちゃん』なのに？,可燕却是‘小燕’？
0000000000000,莉波,ええっと、そ、それは燕ちゃんを\n尊敬してないわけじゃなくて！,呃，那、那不是因为我不尊敬小燕！
0000000000000,莉波,あ、ほら、燕ちゃんって意外と、\n燕ちゃんなところもあるし――,啊，你看，小燕其实也有些地方，\n很像个“小燕”——
0000000000000,星南,フフ、それはちょっとわかるわ。,呵呵，这点我倒稍微理解。
0000000000000,星南,……まあ、気後れさせてしまったのは、\n私の責任でもあるわね。,……不过，让你感到畏惧，\n也是我的责任呢。
0000000000000,星南,あの頃の私は、初星学園の\n規範になろうと必死だったから。,那时候的我，拼命想成为初星学园的典范。
0000000000000,星南,でも、ライバルに敬語は、\nやっぱり、おかしいでしょう？,可是，对竞争对手用敬语，\n果然很奇怪吧？
0000000000000,星南,本気で私を倒すつもりなら、\n私のことは星南って呼び捨てにして。,如果你真想认真打倒我，\n就叫我的名字星南吧，直接点。
0000000000000,莉波,ええっ！？　そ、そんな急には……,诶！？ 这、这么突然……
0000000000000,星南,じゃあ、百歩譲って……\n星南ちゃん、でいいわ。,那让步一百步的话……\n叫星南酱也行。
0000000000000,星南,呼んでご覧なさい、星南ちゃんって。\nさあ、どうぞ。,试着叫一下，叫星南酱。\n来吧，请。
0000000000000,莉波,えぇ～……\nわ、わかりました……こほん。,嗯～……\n好、好吧……咳。
0000000000000,莉波,……せ、星南ちゃん？,……星、星南酱？
0000000000000,星南,フフ、なにかしら？,呵呵，有什么事吗？
0000000000000,莉波,星南ちゃん、私、絶対負けないよ！,星南同学，我绝对不会输的！
0000000000000,星南,いいわ、その調子よ。once more。,很好，就这样。once more。
0000000000000,莉波,星南ちゃん、冬の『H.I.F』で、\nあなたを倒しますっ！,星南同学，在冬季的『H.I.F』上，\n我会打败你的！
0000000000000,星南,……また敬語に戻っているわ。,……你又用回敬语了。
0000000000000,莉波,……す、すみません。\nなんだか、しっくりこなくて……,……对、对不起。\n总感觉，不太自在……
0000000000000,星南,……しかたないわね。\n少しずつ、慣れてきたらでいいわ。,……也没办法呢。\n慢慢来，等你习惯就好。
0000000000000,星南,……日が落ちてきたわね。,……太阳已经落山了呢。
0000000000000,星南,この部屋から見る夕暮の景色が、\nけっこう、好きだったわ。,从这间房间看到的黄昏景色，\n我其实还挺喜欢的。
0000000000000,莉波,私もです。,我也是。
0000000000000,莉波,星がもう、見えはじめてますね。,星星已经，开始看得见了呢。
info,adv_dear_hrnm_029.txt,,
译者,,,
